"Supply Name","Supply ID","Candidate Name","Region","Skill Category","Skills Summary","Experience Level","Qualification Status","Certification Status","Availability Status","Expected Readiness Date","Status","Notes"
"Digital Sales Cohort A","SUP-001","Digital Sales Cohort A","Addis Ababa","Digital Sales","CRM, communication, telesales","Entry level","Yes","No","Available","2026-05-08","Open","Primary feeder pool for DEM-001."
"Support Cohort Gulf 1","SUP-002","Support Cohort Gulf 1","Dubai","Customer Support","Call handling, CRM, service etiquette","Entry level","Yes","No","Pipeline","2026-05-26","In Progress","Language screening still underway."
"Healthcare Support Cohort","SUP-003","Healthcare Support Cohort","Djibouti City","Healthcare Support","Patient care basics, documentation, service","Entry level","Partial","In Progress","Pipeline","2026-06-10","In Progress","Certification in progress."
"Annotation Team East","SUP-004","Annotation Team East","Nairobi","Data Annotation","Labeling, QA, productivity","Graduate entry level","Yes","No","Available","2026-05-20","Open","Ready for rapid mobilization."
"Hospitality Front Office Pool","SUP-005","Hospitality Front Office Pool","Addis Ababa","Front Office","Guest service, reservations, admin support","Junior","Yes","No","Available","2026-06-20","Open","Strong hospitality soft skills."
"QA Associates Pool","SUP-006","QA Associates Pool","Dubai","Software QA","Testing, defect logging, regression support","Junior","Yes","Partial","Pipeline","2026-07-22","In Progress","Awaiting test certification completion."
